{
  "declared_providers": [
    "zcc",
    "zia",
    "zpa",
    "ztc"
  ],
  "kind": "infrawright.root_catalog",
  "resources": [
    {
      "bare_name": "device_cleanup",
      "derived": false,
      "generated": true,
      "product": "zcc",
      "provider": "zcc",
      "slug_label": "zcc_device",
      "type": "zcc_device_cleanup"
    },
    {
      "bare_name": "failopen_policy",
      "derived": false,
      "generated": true,
      "product": "zcc",
      "provider": "zcc",
      "slug_label": "zcc_failopen",
      "type": "zcc_failopen_policy"
    },
    {
      "bare_name": "forwarding_profile",
      "derived": false,
      "generated": true,
      "product": "zcc",
      "provider": "zcc",
      "slug_label": "zcc_forwarding",
      "type": "zcc_forwarding_profile"
    },
    {
      "bare_name": "notification_template",
      "derived": false,
      "generated": true,
      "product": "zcc",
      "provider": "zcc",
      "slug_label": "zcc_notification",
      "type": "zcc_notification_template"
    },
    {
      "bare_name": "trusted_network",
      "derived": false,
      "generated": true,
      "product": "zcc",
      "provider": "zcc",
      "slug_label": "zcc_trusted",
      "type": "zcc_trusted_network"
    },
    {
      "bare_name": "web_privacy",
      "derived": false,
      "generated": true,
      "product": "zcc",
      "provider": "zcc",
      "slug_label": "zcc_web",
      "type": "zcc_web_privacy"
    },
    {
      "bare_name": "zia_posture",
      "derived": false,
      "generated": true,
      "product": "zcc",
      "provider": "zcc",
      "slug_label": "zcc_zia",
      "type": "zcc_zia_posture"
    },
    {
      "bare_name": "activation_status",
      "derived": false,
      "generated": true,
      "product": "zia",
      "provider": "zia",
      "slug_label": "zia_activation",
      "type": "zia_activation_status"
    },
    {
      "bare_name": "admin_roles",
      "derived": false,
      "generated": true,
      "product": "zia",
      "provider": "zia",
      "slug_label": "zia_admin",
      "type": "zia_admin_roles"
    },
    {
      "bare_name": "admin_users",
      "derived": false,
      "generated": true,
      "product": "zia",
      "provider": "zia",
      "slug_label": "zia_admin",
      "type": "zia_admin_users"
    },
    {
      "bare_name": "advanced_settings",
      "derived": false,
      "generated": true,
      "product": "zia",
      "provider": "zia",
      "slug_label": "zia_advanced",
      "type": "zia_advanced_settings"
    },
    {
      "bare_name": "advanced_threat_settings",
      "derived": false,
      "generated": true,
      "product": "zia",
      "provider": "zia",
      "slug_label": "zia_advanced",
      "type": "zia_advanced_threat_settings"
    },
    {
      "bare_name": "atp_malicious_urls",
      "derived": false,
      "generated": true,
      "product": "zia",
      "provider": "zia",
      "slug_label": "zia_atp",
      "type": "zia_atp_malicious_urls"
    },
    {
      "bare_name": "atp_malware_inspection",
      "derived": false,
      "generated": true,
      "product": "zia",
      "provider": "zia",
      "slug_label": "zia_atp",
      "type": "zia_atp_malware_inspection"
    },
    {
      "bare_name": "atp_malware_policy",
      "derived": false,
      "generated": true,
      "product": "zia",
      "provider": "zia",
      "slug_label": "zia_atp",
      "type": "zia_atp_malware_policy"
    },
    {
      "bare_name": "atp_malware_protocols",
      "derived": false,
      "generated": true,
      "product": "zia",
      "provider": "zia",
      "slug_label": "zia_atp",
      "type": "zia_atp_malware_protocols"
    },
    {
      "bare_name": "atp_malware_settings",
      "derived": false,
      "generated": true,
      "product": "zia",
      "provider": "zia",
      "slug_label": "zia_atp",
      "type": "zia_atp_malware_settings"
    },
    {
      "bare_name": "atp_security_exceptions",
      "derived": false,
      "generated": true,
      "product": "zia",
      "provider": "zia",
      "slug_label": "zia_atp",
      "type": "zia_atp_security_exceptions"
    },
    {
      "bare_name": "auth_settings_urls",
      "derived": false,
      "generated": true,
      "product": "zia",
      "provider": "zia",
      "slug_label": "zia_auth",
      "type": "zia_auth_settings_urls"
    },
    {
      "bare_name": "bandwidth_classes",
      "derived": false,
      "generated": true,
      "product": "zia",
      "provider": "zia",
      "slug_label": "zia_bandwidth",
      "type": "zia_bandwidth_classes"
    },
    {
      "bare_name": "bandwidth_classes_file_size",
      "derived": false,
      "generated": true,
      "product": "zia",
      "provider": "zia",
      "slug_label": "zia_bandwidth",
      "type": "zia_bandwidth_classes_file_size"
    },
    {
      "bare_name": "bandwidth_classes_web_conferencing",
      "derived": false,
      "generated": true,
      "product": "zia",
      "provider": "zia",
      "slug_label": "zia_bandwidth",
      "type": "zia_bandwidth_classes_web_conferencing"
    },
    {
      "bare_name": "bandwidth_control_rule",
      "derived": false,
      "generated": true,
      "product": "zia",
      "provider": "zia",
      "slug_label": "zia_bandwidth",
      "type": "zia_bandwidth_control_rule"
    },
    {
      "bare_name": "browser_control_policy",
      "derived": false,
      "generated": true,
      "product": "zia",
      "provider": "zia",
      "slug_label": "zia_browser",
      "type": "zia_browser_control_policy"
    },
    {
      "bare_name": "casb_dlp_rules",
      "derived": false,
      "generated": true,
      "product": "zia",
      "provider": "zia",
      "slug_label": "zia_casb",
      "type": "zia_casb_dlp_rules"
    },
    {
      "bare_name": "casb_malware_rules",
      "derived": false,
      "generated": true,
      "product": "zia",
      "provider": "zia",
      "slug_label": "zia_casb",
      "type": "zia_casb_malware_rules"
    },
    {
      "bare_name": "cloud_app_control_rule",
      "derived": false,
      "generated": true,
      "product": "zia",
      "provider": "zia",
      "slug_label": "zia_cloud",
      "type": "zia_cloud_app_control_rule"
    },
    {
      "bare_name": "cloud_application_instance",
      "derived": false,
      "generated": true,
      "product": "zia",
      "provider": "zia",
      "slug_label": "zia_cloud",
      "type": "zia_cloud_application_instance"
    },
    {
      "bare_name": "cloud_nss_feed",
      "derived": false,
      "generated": true,
      "product": "zia",
      "provider": "zia",
      "slug_label": "zia_cloud",
      "type": "zia_cloud_nss_feed"
    },
    {
      "bare_name": "custom_file_types",
      "derived": false,
      "generated": true,
      "product": "zia",
      "provider": "zia",
      "slug_label": "zia_custom",
      "type": "zia_custom_file_types"
    },
    {
      "bare_name": "dc_exclusions",
      "derived": false,
      "generated": true,
      "product": "zia",
      "provider": "zia",
      "slug_label": "zia_dc",
      "type": "zia_dc_exclusions"
    },
    {
      "bare_name": "dlp_dictionaries",
      "derived": false,
      "generated": true,
      "product": "zia",
      "provider": "zia",
      "slug_label": "zia_dlp",
      "type": "zia_dlp_dictionaries"
    },
    {
      "bare_name": "dlp_engines",
      "derived": false,
      "generated": true,
      "product": "zia",
      "provider": "zia",
      "slug_label": "zia_dlp",
      "type": "zia_dlp_engines"
    },
    {
      "bare_name": "dlp_notification_templates",
      "derived": false,
      "generated": true,
      "product": "zia",
      "provider": "zia",
      "slug_label": "zia_dlp",
      "type": "zia_dlp_notification_templates"
    },
    {
      "bare_name": "dlp_web_rules",
      "derived": false,
      "generated": true,
      "product": "zia",
      "provider": "zia",
      "slug_label": "zia_dlp",
      "type": "zia_dlp_web_rules"
    },
    {
      "bare_name": "email_profile",
      "derived": false,
      "generated": true,
      "product": "zia",
      "provider": "zia",
      "slug_label": "zia_email",
      "type": "zia_email_profile"
    },
    {
      "bare_name": "end_user_notification",
      "derived": false,
      "generated": true,
      "product": "zia",
      "provider": "zia",
      "slug_label": "zia_end",
      "type": "zia_end_user_notification"
    },
    {
      "bare_name": "extranet",
      "derived": false,
      "generated": true,
      "product": "zia",
      "provider": "zia",
      "slug_label": "zia_extranet",
      "type": "zia_extranet"
    },
    {
      "bare_name": "file_type_control_rules",
      "derived": false,
      "generated": true,
      "product": "zia",
      "provider": "zia",
      "slug_label": "zia_file",
      "type": "zia_file_type_control_rules"
    },
    {
      "bare_name": "firewall_dns_rule",
      "derived": false,
      "generated": true,
      "product": "zia",
      "provider": "zia",
      "slug_label": "zia_firewall",
      "type": "zia_firewall_dns_rule"
    },
    {
      "bare_name": "firewall_filtering_destination_groups",
      "derived": false,
      "generated": true,
      "product": "zia",
      "provider": "zia",
      "slug_label": "zia_firewall",
      "type": "zia_firewall_filtering_destination_groups"
    },
    {
      "bare_name": "firewall_filtering_ip_source_groups",
      "derived": false,
      "generated": true,
      "product": "zia",
      "provider": "zia",
      "slug_label": "zia_firewall",
      "type": "zia_firewall_filtering_ip_source_groups"
    },
    {
      "bare_name": "firewall_filtering_network_application_groups",
      "derived": false,
      "generated": true,
      "product": "zia",
      "provider": "zia",
      "slug_label": "zia_firewall",
      "type": "zia_firewall_filtering_network_application_groups"
    },
    {
      "bare_name": "firewall_filtering_network_service",